{
    "center_name": "Stanford",
    "donor_uuid": "5e6233fb-f193-59da-8102-b073a370a94f",
    "program": "TEST",
    "project": "TEST",
    "schema_version": "0.0.2",
    "specimen": [
        {
            "samples": [
                {
                    "analysis": [
                        {
                            "analysis_type": "sequence_upload",
                            "bundle_uuid": "cac0a22d-fb4c-5c6e-8c84-4f9d12ae3fc8",
                            "workflow_name": "Sequence Uploader",
                            "workflow_outputs": [
                                {
                                    "file_path": "sample_upload_files/normal.fastq.gz",
                                    "file_type": "fastq"
                                }
                            ],
                            "workflow_version": "1.0.0"
                        }
                    ],
                    "sample_uuid": "5d4f790c-e079-5f17-b9d7-f7d24a552a55",
                    "submitter_sample_id": "S191920a1"
                }
            ],
            "specimen_uuid": "67ecf138-52ef-5e6a-b96b-b41320209a5b",
            "submitter_specimen_id": "S191920a",
            "submitter_specimen_type": "Normal - blood derived"
        }
    ],
    "submitter_donor_id": "S191920",
    "timestamp": "2016-07-20T21:39:38.985527"
}