{
    "center_name": "Stanford",
    "donor_uuid": "1708baad-237f-58e3-adc6-ae46a23a9c71",
    "program": "TEST",
    "project": "TEST",
    "schema_version": "0.0.2",
    "specimen": [
        {
            "samples": [
                {
                    "analysis": [
                        {
                            "analysis_type": "alignment",
                            "bundle_uuid": "efd4540f-684f-5691-b1d7-acc36cf35a17",
                            "workflow_name": "bwa-mem-aligner",
                            "workflow_outputs": [
                                {
                                    "file_path": "sample_upload_files/normal.bam",
                                    "file_type": "bam"
                                }
                            ],
                            "workflow_version": "1.2.1"
                        }
                    ],
                    "sample_uuid": "2cdfdc6b-ea77-5392-88c5-d8ce7f9a6dd0",
                    "submitter_sample_id": "S176411a1"
                }
            ],
            "specimen_uuid": "bc441512-58bf-5662-ac7b-983315da1841",
            "submitter_specimen_id": "S176411a",
            "submitter_specimen_type": "Normal - blood derived"
        }
    ],
    "submitter_donor_id": "S176411",
    "timestamp": "2016-07-20T21:39:38.985600"
}