{
    "center_name": "Stanford",
    "donor_uuid": "088bda20-30d2-5944-a5fd-fee9a223f1a7",
    "program": "TEST",
    "project": "TEST",
    "schema_version": "0.0.2",
    "specimen": [
        {
            "samples": [
                {
                    "analysis": [
                        {
                            "analysis_type": "sequence_upload",
                            "bundle_uuid": "5c58e075-a2ba-536c-b039-f0418746dcea",
                            "workflow_name": "Sequence Uploader",
                            "workflow_outputs": [
                                {
                                    "file_path": "sample_upload_files/tumor.fastq.gz",
                                    "file_type": "fastq"
                                }
                            ],
                            "workflow_version": "1.0.0"
                        }
                    ],
                    "sample_uuid": "8f2f5091-a6de-5b05-a2b1-331f582f4b41",
                    "submitter_sample_id": "S123472b1"
                }
            ],
            "specimen_uuid": "2d352c29-f993-57cd-9e8b-bb73909c1dbb",
            "submitter_specimen_id": "S123472b",
            "submitter_specimen_type": "Primary tumour - solid tissue"
        }
    ],
    "submitter_donor_id": "S123472",
    "timestamp": "2016-07-20T21:39:38.985476"
}