{
  "center_name": "Stanford",
  "donor_uuid": "088bda20-30d2-5944-a5fd-fee9a223f1a7",
  "program": "TEST",
  "project": "TEST",
  "schema_version": "0.0.1",
  "specimen": [
    {
      "samples": [
        {
          "analysis": [{
            "analysis_type": "sequence_upload",
            "bundle_uuid": "697e0740-d302-5699-b4fb-04c3352565c8",
            "workflow_name": "Sequence Uploader",
            "workflow_outputs": [
              {
                "file_path": "sample_upload_files/tumor.bam",
                "file_type": "bam",
                "file_uuid": "15adb41a-f0ee-5334-994e-0641d8eb9beb"
              }
            ],
            "workflow_version": "1.0.2",
	    "timestamp": "2016-07-19T17:13:30.491517"
          }],
          "sample_uuid": "8f2f5091-a6de-5b05-a2b1-331f582f4b41",
          "submitter_sample_id": "S123472b1"
        }
      ],
      "specimen_uuid": "2d352c29-f993-57cd-9e8b-bb73909c1dbb",
      "submitter_specimen_id": "S123472b",
      "submitter_specimen_type": "Primary tumour - solid tissue"
    }
  ],
  "submitter_donor_id": "S123472",
  "timestamp": "2016-07-19T17:13:37.491517"
}
