{
    "center_name": "Stanford",
    "donor_uuid": "0f1d53cb-9ef8-58ba-8db6-4eae42ee4316",
    "program": "TEST",
    "project": "TEST",
    "schema_version": "0.0.2",
    "specimen": [
        {
            "samples": [
                {
                    "analysis": [
                        {
                            "analysis_type": "sequence_upload",
                            "bundle_uuid": "433c5ef9-e4db-5602-923c-1d454a9baad5",
                            "workflow_name": "Sequence Uploader",
                            "workflow_outputs": [
                                {
                                    "file_path": "sample_upload_files/normal.fastq.gz",
                                    "file_type": "fastq"
                                }
                            ],
                            "workflow_version": "1.0.0"
                        }
                    ],
                    "sample_uuid": "efd00a1d-604e-5e65-bf88-1c1464f14faa",
                    "submitter_sample_id": "S627291a1"
                }
            ],
            "specimen_uuid": "92511bd2-d5d8-51f4-8c0c-1cb53d54c6bf",
            "submitter_specimen_id": "S627291a",
            "submitter_specimen_type": "Normal - blood derived"
        }
    ],
    "submitter_donor_id": "S627291",
    "timestamp": "2016-07-20T21:39:38.985705"
}