{
    "center_name": "Stanford",
    "donor_uuid": "b121a26b-282c-5830-9084-c3b74bb56fc0",
    "program": "TEST",
    "project": "TEST",
    "schema_version": "0.0.2",
    "specimen": [
        {
            "samples": [
                {
                    "analysis": [
                        {
                            "analysis_type": "alignment",
                            "bundle_uuid": "a21dac21-f49f-556a-b463-859a66d8d0f5",
                            "workflow_name": "bwa-mem-aligner",
                            "workflow_outputs": [
                                {
                                    "file_path": "sample_upload_files/tumor.bam",
                                    "file_type": "bam"
                                }
                            ],
                            "workflow_version": "1.2.1"
                        }
                    ],
                    "sample_uuid": "a8f34297-27a0-5609-bd62-0d8b8872dea2",
                    "submitter_sample_id": "S917367b1"
                }
            ],
            "specimen_uuid": "fcd4a069-e881-59a1-a506-d8ec1071a9c8",
            "submitter_specimen_id": "S917367b",
            "submitter_specimen_type": "Primary tumour - solid tissue"
        }
    ],
    "submitter_donor_id": "S917367",
    "timestamp": "2016-07-20T21:39:38.985671"
}