{
    "center_name": "Stanford",
    "donor_uuid": "088bda20-30d2-5944-a5fd-fee9a223f1a7",
    "program": "TEST",
    "project": "TEST",
    "schema_version": "0.0.2",
    "specimen": [
        {
            "samples": [
                {
                    "analysis": [
                        {
                            "analysis_type": "alignment",
                            "bundle_uuid": "2d49242e-b8f9-50ff-b304-158588382735",
                            "workflow_name": "bwa-mem-aligner",
                            "workflow_outputs": [
                                {
                                    "file_path": "sample_upload_files/tumor.bam",
                                    "file_type": "bam"
                                }
                            ],
                            "workflow_version": "1.2.1"
                        }
                    ],
                    "sample_uuid": "8f2f5091-a6de-5b05-a2b1-331f582f4b41",
                    "submitter_sample_id": "S123472b1"
                }
            ],
            "specimen_uuid": "2d352c29-f993-57cd-9e8b-bb73909c1dbb",
            "submitter_specimen_id": "S123472b",
            "submitter_specimen_type": "Primary tumour - solid tissue"
        }
    ],
    "submitter_donor_id": "S123472",
    "timestamp": "2016-07-20T21:39:38.985491"
}