{
    "center_name": "Stanford",
    "donor_uuid": "5e6233fb-f193-59da-8102-b073a370a94f",
    "program": "TEST",
    "project": "TEST",
    "schema_version": "0.0.2",
    "specimen": [
        {
            "samples": [
                {
                    "analysis": [
                        {
                            "analysis_type": "germline_variant_calling",
                            "bundle_uuid": "7e39efc2-b12a-5d62-9542-8bbd5d4715c9",
                            "workflow_name": "germline-gatk",
                            "workflow_outputs": [
                                {
                                    "file_path": "sample_upload_files/germline.vcf",
                                    "file_type": "vcf"
                                }
                            ],
                            "workflow_version": "2.1.1"
                        }
                    ],
                    "sample_uuid": "5d4f790c-e079-5f17-b9d7-f7d24a552a55",
                    "submitter_sample_id": "S191920a1"
                }
            ],
            "specimen_uuid": "67ecf138-52ef-5e6a-b96b-b41320209a5b",
            "submitter_specimen_id": "S191920a",
            "submitter_specimen_type": "Normal - blood derived"
        }
    ],
    "submitter_donor_id": "S191920",
    "timestamp": "2016-07-20T21:39:38.985559"
}