{
    "center_name": "Stanford",
    "donor_uuid": "088bda20-30d2-5944-a5fd-fee9a223f1a7",
    "program": "TEST",
    "project": "TEST",
    "schema_version": "0.0.2",
    "specimen": [
        {
            "samples": [
                {
                    "analysis": [
                        {
                            "analysis_type": "sequence_upload",
                            "bundle_uuid": "ca3ccf42-c0ea-553b-b19f-e34570a1f03c",
                            "workflow_name": "Sequence Uploader",
                            "workflow_outputs": [
                                {
                                    "file_path": "sample_upload_files/normal.fastq.gz",
                                    "file_type": "fastq"
                                }
                            ],
                            "workflow_version": "1.0.0"
                        }
                    ],
                    "sample_uuid": "0c34704b-dd86-5141-aaf0-573656dee389",
                    "submitter_sample_id": "S123472a1"
                }
            ],
            "specimen_uuid": "03a781e4-e6a9-5d61-861e-49fcd034c5e4",
            "submitter_specimen_id": "S123472a",
            "submitter_specimen_type": "Normal - blood derived"
        }
    ],
    "submitter_donor_id": "S123472",
    "timestamp": "2016-07-20T21:39:38.985462"
}